{
	"$schema": "../package/core/schemas/theme.schema.json",
	"name": "Playful",
	"author": "Om Mishra",
	"version": "1.0.0",
	"description": "A lively pack of bouncy pitch sweeps and energetic tones with a playful, cartoon-like character, perfect for gamified flows, rewards, and moments that should feel fun and upbeat.",
	"sounds": {
		"success": {
			"layers": [
				{
					"source": {
						"type": "sine",
						"frequency": { "start": 400, "end": 523 }
					},
					"envelope": {
						"attack": 0,
						"decay": 0.15,
						"sustain": 0.04,
						"release": 0.06
					},
					"gain": 0.2
				},
				{
					"source": {
						"type": "sine",
						"frequency": { "start": 500, "end": 659 }
					},
					"envelope": {
						"attack": 0,
						"decay": 0.14,
						"sustain": 0.03,
						"release": 0.06
					},
					"delay": 0.08,
					"gain": 0.18
				},
				{
					"source": {
						"type": "sine",
						"frequency": { "start": 600, "end": 880 }
					},
					"envelope": {
						"attack": 0,
						"decay": 0.16,
						"sustain": 0.03,
						"release": 0.06
					},
					"delay": 0.16,
					"gain": 0.16
				}
			]
		},
		"error": {
			"layers": [
				{
					"source": {
						"type": "sine",
						"frequency": { "start": 500, "end": 150 },
						"fm": { "ratio": 0.5, "depth": 80 }
					},
					"envelope": {
						"attack": 0,
						"decay": 0.15,
						"sustain": 0,
						"release": 0.05
					},
					"gain": 0.25
				},
				{
					"source": {
						"type": "sine",
						"frequency": { "start": 400, "end": 100 }
					},
					"envelope": {
						"attack": 0,
						"decay": 0.12,
						"sustain": 0,
						"release": 0.04
					},
					"delay": 0.05,
					"gain": 0.18
				}
			]
		},
		"warning": {
			"layers": [
				{
					"source": {
						"type": "sine",
						"frequency": { "start": 500, "end": 380 }
					},
					"envelope": {
						"attack": 0,
						"decay": 0.1,
						"sustain": 0.03,
						"release": 0.04
					},
					"gain": 0.22
				},
				{
					"source": {
						"type": "sine",
						"frequency": { "start": 520, "end": 400 }
					},
					"envelope": {
						"attack": 0,
						"decay": 0.1,
						"sustain": 0.03,
						"release": 0.04
					},
					"delay": 0.015,
					"gain": 0.16
				}
			]
		},
		"info": {
			"source": { "type": "sine", "frequency": { "start": 600, "end": 900 } },
			"envelope": {
				"attack": 0,
				"decay": 0.12,
				"sustain": 0.02,
				"release": 0.04
			},
			"gain": 0.16
		},
		"click": {
			"source": {
				"type": "sine",
				"frequency": { "start": 300, "end": 900 },
				"fm": { "ratio": 0.5, "depth": 60 }
			},
			"envelope": {
				"attack": 0,
				"decay": 0.08,
				"sustain": 0,
				"release": 0.025
			},
			"gain": 0.25
		},
		"back": {
			"source": { "type": "sine", "frequency": { "start": 1000, "end": 500 } },
			"envelope": { "attack": 0, "decay": 0.1, "sustain": 0, "release": 0.035 },
			"gain": 0.2
		},
		"enter": {
			"source": { "type": "sine", "frequency": { "start": 500, "end": 1200 } },
			"envelope": { "attack": 0, "decay": 0.1, "sustain": 0, "release": 0.035 },
			"gain": 0.22
		},
		"delete": {
			"source": { "type": "sine", "frequency": { "start": 700, "end": 100 } },
			"envelope": { "attack": 0, "decay": 0.18, "sustain": 0, "release": 0.06 },
			"gain": 0.22
		},
		"copy": {
			"layers": [
				{
					"source": {
						"type": "sine",
						"frequency": { "start": 800, "end": 1200 }
					},
					"envelope": {
						"attack": 0,
						"decay": 0.03,
						"sustain": 0,
						"release": 0.01
					},
					"gain": 0.18
				},
				{
					"source": {
						"type": "sine",
						"frequency": { "start": 1000, "end": 1500 }
					},
					"envelope": {
						"attack": 0,
						"decay": 0.03,
						"sustain": 0,
						"release": 0.01
					},
					"delay": 0.05,
					"gain": 0.15
				}
			]
		},
		"paste": {
			"source": { "type": "sine", "frequency": { "start": 1200, "end": 800 } },
			"envelope": { "attack": 0, "decay": 0.06, "sustain": 0, "release": 0.02 },
			"gain": 0.18
		},
		"scroll": {
			"source": { "type": "sine", "frequency": { "start": 1400, "end": 1600 } },
			"envelope": {
				"attack": 0,
				"decay": 0.02,
				"sustain": 0,
				"release": 0.008
			},
			"gain": 0.08
		},
		"hover": {
			"source": { "type": "sine", "frequency": { "start": 1200, "end": 1500 } },
			"envelope": { "attack": 0, "decay": 0.03, "sustain": 0, "release": 0.01 },
			"gain": 0.08
		},
		"toggle": {
			"source": { "type": "sine", "frequency": { "start": 600, "end": 1000 } },
			"envelope": {
				"attack": 0,
				"decay": 0.08,
				"sustain": 0,
				"release": 0.025
			},
			"gain": 0.2
		},
		"notify": {
			"layers": [
				{
					"source": {
						"type": "sine",
						"frequency": { "start": 500, "end": 880 }
					},
					"envelope": {
						"attack": 0,
						"decay": 0.18,
						"sustain": 0.03,
						"release": 0.06
					},
					"gain": 0.2
				},
				{
					"source": {
						"type": "sine",
						"frequency": { "start": 700, "end": 1320 }
					},
					"envelope": {
						"attack": 0,
						"decay": 0.15,
						"sustain": 0.02,
						"release": 0.05
					},
					"delay": 0.1,
					"gain": 0.16
				}
			]
		},
		"complete": {
			"layers": [
				{
					"source": {
						"type": "sine",
						"frequency": { "start": 400, "end": 600 }
					},
					"envelope": {
						"attack": 0,
						"decay": 0.12,
						"sustain": 0.02,
						"release": 0.04
					},
					"gain": 0.18
				},
				{
					"source": {
						"type": "sine",
						"frequency": { "start": 600, "end": 900 }
					},
					"envelope": {
						"attack": 0,
						"decay": 0.12,
						"sustain": 0.02,
						"release": 0.04
					},
					"delay": 0.06,
					"gain": 0.16
				},
				{
					"source": {
						"type": "sine",
						"frequency": { "start": 800, "end": 1200 }
					},
					"envelope": {
						"attack": 0,
						"decay": 0.12,
						"sustain": 0.02,
						"release": 0.04
					},
					"delay": 0.12,
					"gain": 0.14
				}
			]
		},
		"loading": {
			"source": { "type": "sine", "frequency": { "start": 500, "end": 700 } },
			"envelope": {
				"attack": 0.01,
				"decay": 0.15,
				"sustain": 0.03,
				"release": 0.05
			},
			"gain": 0.12
		},
		"tap": {
			"source": { "type": "sine", "frequency": { "start": 1400, "end": 800 } },
			"envelope": { "attack": 0, "decay": 0.06, "sustain": 0, "release": 0.02 },
			"gain": 0.22
		},
		"press": {
			"source": { "type": "sine", "frequency": { "start": 1600, "end": 1000 } },
			"envelope": {
				"attack": 0,
				"decay": 0.04,
				"sustain": 0,
				"release": 0.012
			},
			"gain": 0.18
		},
		"release": {
			"source": { "type": "sine", "frequency": { "start": 1200, "end": 800 } },
			"envelope": { "attack": 0, "decay": 0.06, "sustain": 0, "release": 0.02 },
			"gain": 0.14
		},
		"drag": {
			"source": { "type": "sine", "frequency": { "start": 700, "end": 900 } },
			"envelope": {
				"attack": 0.005,
				"decay": 0.1,
				"sustain": 0.02,
				"release": 0.04
			},
			"gain": 0.12
		},
		"drop": {
			"source": { "type": "sine", "frequency": { "start": 1000, "end": 400 } },
			"envelope": { "attack": 0, "decay": 0.12, "sustain": 0, "release": 0.04 },
			"gain": 0.18
		},
		"select": {
			"source": { "type": "sine", "frequency": { "start": 500, "end": 1000 } },
			"envelope": { "attack": 0, "decay": 0.07, "sustain": 0, "release": 0.02 },
			"gain": 0.2
		},
		"deselect": {
			"source": { "type": "sine", "frequency": { "start": 800, "end": 400 } },
			"envelope": {
				"attack": 0,
				"decay": 0.06,
				"sustain": 0,
				"release": 0.018
			},
			"gain": 0.16
		},
		"focus": {
			"source": { "type": "sine", "frequency": { "start": 1000, "end": 1300 } },
			"envelope": {
				"attack": 0,
				"decay": 0.05,
				"sustain": 0,
				"release": 0.015
			},
			"gain": 0.1
		},
		"blur": {
			"source": { "type": "sine", "frequency": { "start": 1100, "end": 900 } },
			"envelope": {
				"attack": 0,
				"decay": 0.04,
				"sustain": 0,
				"release": 0.012
			},
			"gain": 0.08
		},
		"forward": {
			"source": { "type": "sine", "frequency": { "start": 500, "end": 1000 } },
			"envelope": {
				"attack": 0,
				"decay": 0.08,
				"sustain": 0,
				"release": 0.025
			},
			"gain": 0.18
		},
		"open": {
			"source": { "type": "sine", "frequency": { "start": 400, "end": 1200 } },
			"envelope": { "attack": 0, "decay": 0.12, "sustain": 0, "release": 0.04 },
			"gain": 0.16
		},
		"close": {
			"source": { "type": "sine", "frequency": { "start": 1200, "end": 400 } },
			"envelope": { "attack": 0, "decay": 0.12, "sustain": 0, "release": 0.04 },
			"gain": 0.14
		},
		"expand": {
			"source": { "type": "sine", "frequency": { "start": 300, "end": 900 } },
			"envelope": {
				"attack": 0,
				"decay": 0.12,
				"sustain": 0.02,
				"release": 0.04
			},
			"gain": 0.16
		},
		"collapse": {
			"source": { "type": "sine", "frequency": { "start": 900, "end": 300 } },
			"envelope": {
				"attack": 0,
				"decay": 0.12,
				"sustain": 0.02,
				"release": 0.04
			},
			"gain": 0.16
		},
		"tab": {
			"source": { "type": "sine", "frequency": { "start": 600, "end": 1400 } },
			"envelope": {
				"attack": 0,
				"decay": 0.06,
				"sustain": 0,
				"release": 0.018
			},
			"gain": 0.2
		},
		"swipe": {
			"source": { "type": "sine", "frequency": { "start": 400, "end": 1600 } },
			"envelope": { "attack": 0, "decay": 0.1, "sustain": 0, "release": 0.035 },
			"gain": 0.14
		},
		"confirm": {
			"source": { "type": "sine", "frequency": { "start": 500, "end": 1100 } },
			"envelope": { "attack": 0, "decay": 0.1, "sustain": 0, "release": 0.035 },
			"gain": 0.22
		},
		"cancel": {
			"source": { "type": "sine", "frequency": { "start": 900, "end": 400 } },
			"envelope": { "attack": 0, "decay": 0.1, "sustain": 0, "release": 0.035 },
			"gain": 0.18
		},
		"deny": {
			"source": { "type": "sine", "frequency": { "start": 800, "end": 200 } },
			"envelope": { "attack": 0, "decay": 0.15, "sustain": 0, "release": 0.05 },
			"gain": 0.2
		},
		"undo": {